{
  "collection_id": "atlcol-3500000000000002",
  "schema_version": "1.0.0",
  "experiment_id": "E35_cross_observer",
  "collector": {
    "name": "trustlab-adb",
    "version": "0.3.0-dev0"
  },
  "observer": {
    "observer_type": "adb_shell",
    "privilege_level": "shell",
    "collection_method": "adb_shell_snapshot"
  },
  "target": {
    "pseudonymous_id": "target-3535353535353535",
    "target_type": "avd"
  },
  "started_at": "2026-07-16T12:00:02Z",
  "ended_at": "2026-07-16T12:00:03Z",
  "completion_status": "complete",
  "tool_versions": {
    "adb": "36.0.0",
    "android_shell": "toybox",
    "ps": "unknown"
  },
  "environment": {
    "platform": "android",
    "transport": "adb",
    "execution_context": "adb_collector"
  },
  "warnings": [],
  "redaction_policy": {
    "policy_id": "atl_portable_v1",
    "redaction_state": "applied",
    "direct_identifiers_removed": true,
    "serials_removed": true,
    "secrets_removed": true
  },
  "artifacts": [
    {
      "logical_name": "raw_report",
      "relative_path": "adb_snapshot.txt",
      "media_type": "text/plain",
      "byte_size": 1497,
      "sha256": "aeae07a7317a1be82374170599aedd18a0b27598485eac09f8c41fad06a2f999",
      "probe_id": "adb.readonly_snapshot",
      "status": "observed",
      "exit_code": 0,
      "timed_out": false,
      "sensitivity": "internal",
      "redaction_state": "redacted",
      "detail": null
    }
  ]
}
