{
  "collection_id": "atlcol-3500000000000003",
  "schema_version": "1.0.0",
  "experiment_id": "E35_cross_observer",
  "collector": {
    "name": "trustlab-magisk",
    "version": "0.3.0-dev0"
  },
  "observer": {
    "observer_type": "root_collector",
    "privilege_level": "root",
    "collection_method": "magisk_module_manual"
  },
  "target": {
    "pseudonymous_id": "target-3535353535353535",
    "target_type": "avd"
  },
  "started_at": "2026-07-16T12:00:04Z",
  "ended_at": "2026-07-16T12:00:05Z",
  "completion_status": "complete",
  "tool_versions": {
    "android_shell": "toybox",
    "trustlab_magisk": "0.3.0-dev0"
  },
  "environment": {
    "platform": "android",
    "transport": "on_device",
    "execution_context": "magisk_module"
  },
  "warnings": [],
  "redaction_policy": {
    "policy_id": "atl_portable_v1",
    "redaction_state": "applied",
    "direct_identifiers_removed": true,
    "serials_removed": true,
    "secrets_removed": true
  },
  "artifacts": [
    {
      "logical_name": "raw_report",
      "relative_path": "raw.txt",
      "media_type": "text/plain",
      "byte_size": 1843,
      "sha256": "bb4c864937b5e49df78654cb140ea93086fcbaecd7a1eb069cdafb6ad9c92dc2",
      "probe_id": "magisk.readonly_snapshot",
      "status": "observed",
      "exit_code": 0,
      "timed_out": false,
      "sensitivity": "sensitive",
      "redaction_state": "redacted",
      "detail": null
    }
  ]
}
